[
  {
    "slug": "grid",
    "title": "Grid",
    "description": "**Collection:** `grid/` · immutable source evidence",
    "entries": [
      {
        "rel": "grid/wilmington/2023-03-30-clinton-345kv-substation-extension-project.aes-ohio.wayback.html",
        "name": "2023-03-30-clinton-345kv-substation-extension-project.aes-ohio.wayback.html",
        "size_bytes": 90997,
        "suffix": "html",
        "media_type": "text/html",
        "render_class": "html",
        "published": false,
        "available": true,
        "download_url": null,
        "duplicate_cluster": null,
        "canonical_document_id": null,
        "version": null,
        "supersedes": []
      },
      {
        "rel": "grid/wilmington/2026-08-06-fayette-customer-east-345kv-transmission-line-project.aes-ohio.html",
        "name": "2026-08-06-fayette-customer-east-345kv-transmission-line-project.aes-ohio.html",
        "size_bytes": 65248,
        "suffix": "html",
        "media_type": "text/html",
        "render_class": "html",
        "published": false,
        "available": true,
        "download_url": null,
        "duplicate_cluster": null,
        "canonical_document_id": null,
        "version": null,
        "supersedes": []
      },
      {
        "rel": "grid/wilmington/2026-08-06-fayette-customer-west-345kv-transmission-line-project.aes-ohio.html",
        "name": "2026-08-06-fayette-customer-west-345kv-transmission-line-project.aes-ohio.html",
        "size_bytes": 65410,
        "suffix": "html",
        "media_type": "text/html",
        "render_class": "html",
        "published": false,
        "available": true,
        "download_url": null,
        "duplicate_cluster": null,
        "canonical_document_id": null,
        "version": null,
        "supersedes": []
      },
      {
        "rel": "grid/wilmington/20260203-item-06---dayton-supplemental-projects.pdf",
        "name": "20260203-item-06---dayton-supplemental-projects.pdf",
        "size_bytes": 1293704,
        "suffix": "pdf",
        "media_type": "application/pdf",
        "render_class": "pdf",
        "published": false,
        "available": true,
        "download_url": null,
        "duplicate_cluster": null,
        "canonical_document_id": null,
        "version": null,
        "supersedes": []
      },
      {
        "rel": "grid/wilmington/20260508-item-05---dayton-supplemental-projects.pdf",
        "name": "20260508-item-05---dayton-supplemental-projects.pdf",
        "size_bytes": 676207,
        "suffix": "pdf",
        "media_type": "application/pdf",
        "render_class": "pdf",
        "published": false,
        "available": true,
        "download_url": null,
        "duplicate_cluster": null,
        "canonical_document_id": null,
        "version": null,
        "supersedes": []
      },
      {
        "rel": "grid/wilmington/20260707-item-11---dayton-supplemental-projects.pdf",
        "name": "20260707-item-11---dayton-supplemental-projects.pdf",
        "size_bytes": 1085941,
        "suffix": "pdf",
        "media_type": "application/pdf",
        "render_class": "pdf",
        "published": false,
        "available": true,
        "download_url": null,
        "duplicate_cluster": null,
        "canonical_document_id": null,
        "version": null,
        "supersedes": []
      },
      {
        "rel": "grid/wilmington/2d28e900-service-of-letter-notification-fayette-to-clinton-345-kv-transmission-line-project-puco-case-25-0871-el-bln.pdf",
        "name": "2d28e900-service-of-letter-notification-fayette-to-clinton-345-kv-transmission-line-project-puco-case-25-0871-el-bln.pdf",
        "size_bytes": 686469,
        "suffix": "pdf",
        "media_type": "application/pdf",
        "render_class": "pdf",
        "published": false,
        "available": true,
        "download_url": null,
        "duplicate_cluster": null,
        "canonical_document_id": null,
        "version": null,
        "supersedes": []
      },
      {
        "rel": "grid/wilmington/AES-Ohio-Fayette-Clinton-Project-Need-Oct-25.pdf",
        "name": "AES-Ohio-Fayette-Clinton-Project-Need-Oct-25.pdf",
        "size_bytes": 2339215,
        "suffix": "pdf",
        "media_type": "application/pdf",
        "render_class": "pdf",
        "published": false,
        "available": true,
        "download_url": null,
        "duplicate_cluster": null,
        "canonical_document_id": null,
        "version": null,
        "supersedes": []
      },
      {
        "rel": "grid/wilmington/FAQ-Fayette-Clinton-AES-Ohio-Nov-2025.pdf",
        "name": "FAQ-Fayette-Clinton-AES-Ohio-Nov-2025.pdf",
        "size_bytes": 154281,
        "suffix": "pdf",
        "media_type": "application/pdf",
        "render_class": "pdf",
        "published": false,
        "available": true,
        "download_url": null,
        "duplicate_cluster": null,
        "canonical_document_id": null,
        "version": null,
        "supersedes": []
      },
      {
        "rel": "grid/wilmington/FAYETT1.pdf",
        "name": "FAYETT1.pdf",
        "size_bytes": 98827,
        "suffix": "pdf",
        "media_type": "application/pdf",
        "render_class": "pdf",
        "published": false,
        "available": true,
        "download_url": null,
        "duplicate_cluster": null,
        "canonical_document_id": null,
        "version": null,
        "supersedes": []
      },
      {
        "rel": "grid/wilmington/fayette_to_clinton_345_kv_project_fact_sheet.pdf",
        "name": "fayette_to_clinton_345_kv_project_fact_sheet.pdf",
        "size_bytes": 574730,
        "suffix": "pdf",
        "media_type": "application/pdf",
        "render_class": "pdf",
        "published": false,
        "available": true,
        "download_url": null,
        "duplicate_cluster": null,
        "canonical_document_id": null,
        "version": null,
        "supersedes": []
      }
    ]
  },
  {
    "slug": "oepa",
    "title": "Ohio EPA",
    "description": "**Collection:** `oepa/` · immutable source evidence",
    "entries": [
      {
        "rel": "oepa/wilmington/1II00129.pdf",
        "name": "1II00129.pdf",
        "size_bytes": 1237588,
        "suffix": "pdf",
        "media_type": "application/pdf",
        "render_class": "pdf",
        "published": true,
        "available": true,
        "download_url": null,
        "duplicate_cluster": null,
        "canonical_document_id": null,
        "version": null,
        "supersedes": []
      },
      {
        "rel": "oepa/wilmington/1IW00240.pdf",
        "name": "1IW00240.pdf",
        "size_bytes": 900805,
        "suffix": "pdf",
        "media_type": "application/pdf",
        "render_class": "pdf",
        "published": true,
        "available": true,
        "download_url": null,
        "duplicate_cluster": null,
        "canonical_document_id": null,
        "version": null,
        "supersedes": []
      },
      {
        "rel": "oepa/wilmington/1MP00060.pdf",
        "name": "1MP00060.pdf",
        "size_bytes": 21961735,
        "suffix": "pdf",
        "media_type": "application/pdf",
        "render_class": "pdf",
        "published": true,
        "available": true,
        "download_url": null,
        "duplicate_cluster": null,
        "canonical_document_id": null,
        "version": null,
        "supersedes": []
      },
      {
        "rel": "oepa/wilmington/1PD00013.fs.pdf",
        "name": "1PD00013.fs.pdf",
        "size_bytes": 1001249,
        "suffix": "pdf",
        "media_type": "application/pdf",
        "render_class": "pdf",
        "published": true,
        "available": true,
        "download_url": null,
        "duplicate_cluster": null,
        "canonical_document_id": null,
        "version": null,
        "supersedes": []
      },
      {
        "rel": "oepa/wilmington/1PD00013.pdf",
        "name": "1PD00013.pdf",
        "size_bytes": 1881507,
        "suffix": "pdf",
        "media_type": "application/pdf",
        "render_class": "pdf",
        "published": true,
        "available": true,
        "download_url": null,
        "duplicate_cluster": null,
        "canonical_document_id": null,
        "version": null,
        "supersedes": []
      },
      {
        "rel": "oepa/wilmington/1PT00125.pdf",
        "name": "1PT00125.pdf",
        "size_bytes": 560485,
        "suffix": "pdf",
        "media_type": "application/pdf",
        "render_class": "pdf",
        "published": true,
        "available": true,
        "download_url": null,
        "duplicate_cluster": null,
        "canonical_document_id": null,
        "version": null,
        "supersedes": []
      },
      {
        "rel": "oepa/wilmington/1PV00089.pdf",
        "name": "1PV00089.pdf",
        "size_bytes": 326434,
        "suffix": "pdf",
        "media_type": "application/pdf",
        "render_class": "pdf",
        "published": true,
        "available": true,
        "download_url": null,
        "duplicate_cluster": null,
        "canonical_document_id": null,
        "version": null,
        "supersedes": []
      },
      {
        "rel": "oepa/wilmington/1PX00010.pdf",
        "name": "1PX00010.pdf",
        "size_bytes": 350164,
        "suffix": "pdf",
        "media_type": "application/pdf",
        "render_class": "pdf",
        "published": true,
        "available": true,
        "download_url": null,
        "duplicate_cluster": null,
        "canonical_document_id": null,
        "version": null,
        "supersedes": []
      }
    ]
  }
]
