[
  {
    "slug": "oepa",
    "title": "Ohio EPA",
    "description": "**Collection:** `oepa/` · immutable source evidence",
    "entries": [
      {
        "rel": "oepa/wpafb/edoc-2090290.pdf",
        "name": "edoc-2090290.pdf",
        "size_bytes": 19979,
        "suffix": "pdf",
        "media_type": "application/pdf",
        "render_class": "pdf",
        "published": true,
        "available": true,
        "download_url": null,
        "duplicate_cluster": null,
        "canonical_document_id": null,
        "version": null,
        "supersedes": []
      }
    ]
  },
  {
    "slug": "wpafb",
    "title": "Wpafb",
    "description": "",
    "entries": [
      {
        "rel": "wpafb/ccr/2025-Water-Quality-Report.pdf",
        "name": "2025-Water-Quality-Report.pdf",
        "size_bytes": 1276985,
        "suffix": "pdf",
        "media_type": "application/pdf",
        "render_class": "pdf",
        "published": false,
        "available": true,
        "download_url": null,
        "duplicate_cluster": null,
        "canonical_document_id": null,
        "version": null,
        "supersedes": []
      },
      {
        "rel": "wpafb/cercla/wright-pattersonafb.pdf",
        "name": "wright-pattersonafb.pdf",
        "size_bytes": 2385648,
        "suffix": "pdf",
        "media_type": "application/pdf",
        "render_class": "pdf",
        "published": false,
        "available": true,
        "download_url": null,
        "duplicate_cluster": null,
        "canonical_document_id": null,
        "version": null,
        "supersedes": []
      },
      {
        "rel": "wpafb/ssa/SSA_greatmiaminorth_FR.pdf",
        "name": "SSA_greatmiaminorth_FR.pdf",
        "size_bytes": 38318,
        "suffix": "pdf",
        "media_type": "application/pdf",
        "render_class": "pdf",
        "published": false,
        "available": true,
        "download_url": null,
        "duplicate_cluster": null,
        "canonical_document_id": null,
        "version": null,
        "supersedes": []
      }
    ]
  }
]
